{"corpus_catalog":{"byte_count":6670,"path":"evals/recursus/career-bench-v1/catalog.json","sha256":"279236023eceaa105aa0c13d20c5867d860423f0d6d297c3052074e1ad230200"},"harness_bundle_sha256":"7273f85f6f3f52979d7364a29d727703c783931b5e48b9ae8576270bbe47dcaa","harness_files":[{"byte_count":2218,"path":"capture-recursus-reference-v4.mjs","sha256":"e2a6a91ecef8f74d0a68eee7fdd243dcaa200865230e98eded5814a535a61c65"},{"byte_count":2300,"path":"evals/recursus/rc2-claude-code-reference-v4/README.md","sha256":"5041eb307e462e270cf87ac065af17802185667cd13eb48177cccad744a4f14f"},{"byte_count":1959,"path":"evals/recursus/rc2-claude-code-reference-v4/schemas/invocation.schema.json","sha256":"2bf9a59ea4ff95dd3e005d926019bcf7ffe7d4d758ff95cd4b6e569788220c6e"},{"byte_count":2078,"path":"evals/recursus/rc2-claude-code-reference-v4/schemas/ledger-entry.schema.json","sha256":"9a1009eaecde9ec7d78ddadb2c75eae9c4767ad3b71745cf0c5d82f980f317a8"},{"byte_count":4243,"path":"evals/recursus/rc2-claude-code-reference-v4/schemas/normalized-result.schema.json","sha256":"2c859840a3de7a254c2fa805a7bce1407fabc74f48401cdb0299ebed5c0f9808"},{"byte_count":8693,"path":"evals/recursus/rc2-claude-code-reference-v4/schemas/registration.schema.json","sha256":"1e0eec34af4b7a1b65808113894ac08fda484b05b2cd251d89610e88f33c2c2e"},{"byte_count":8133,"path":"evals/recursus/rc2-claude-code-reference-v4/schemas/runner-manifest.schema.json","sha256":"08e8f0bcc40a1864e3430fb395b460836120a36a6a237fd18ecb7deaa805817e"},{"byte_count":2095,"path":"evals/recursus/rc2-claude-code-reference-v4/schemas/source-snapshot.schema.json","sha256":"bf33adfd6b4a697b6e3fb14ff8dcc754827be0c18243f634bedb18ed3ffa00e2"},{"byte_count":1592,"path":"evals/recursus/rc2-claude-code-reference-v4/schemas/trace.schema.json","sha256":"563a2a5225ab6d419c6971cbc5a93a36f78fe064fde4c400deb50dcdd882af11"},{"byte_count":2330,"path":"evals/recursus/rc2-claude-code-reference-v4/schemas/validation-result.schema.json","sha256":"cd30a4fe43c2c23d50c53bd9d54fd5e182cc6ffc93703ca1c216e1d0563120d6"},{"byte_count":60658,"path":"lib/recursus-benchmark.mjs","sha256":"769948690b99e00047035126fc3085875e30fd7b5f89df3a7785c8536c3a98b9"},{"byte_count":21038,"path":"lib/recursus-reference-capture-v4.mjs","sha256":"54d9a5f6d49cc7f16c07a994794877d251d16cb9cee38e4c6d0a08167a3d84c5"},{"byte_count":125147,"path":"lib/recursus-reference-v4.mjs","sha256":"a85d84d39ed9745f205b25927fb2f405c79b9a65cbbb2b10ccbe396f8e065c18"},{"byte_count":4086,"path":"package.json","sha256":"a9276aeb3e684c1e43e2918d30b474d113c371cf308b59de8fd297666f2b3f9a"},{"byte_count":3397,"path":"prepare-recursus-reference-v4.mjs","sha256":"c6bf7aaf9257e30d3a5d601ff6496628c7d7e28b0b059994c2f0c1f633a22cb1"},{"byte_count":1853,"path":"verify-recursus-reference-v4.mjs","sha256":"ac990a72cd0f13bc6268c635f0c3babf2debe2671a965eb2497a2ada8cb448ce"}],"instruction_bundle_sha256":"57b36f561715e00046a9b1f72407cc343bcc3d3e67c5257d7115bf6d1a29c1d3","instruction_files":[{"byte_count":10188,"path":".agents/skills/career-ops/SKILL.md","sha256":"2f1d37bf7a84efcda91573925dad58a6fe304d77a0e6e415fa1ae8e9d027678c"},{"byte_count":41710,"path":"AGENTS.md","sha256":"a43d09b2b42d719c19f24b75ea2522951a0b4d7fa04a5715eb4292b474f465f9"},{"byte_count":103,"path":"CLAUDE.md","sha256":"4e39c2b90691943c74674c606a8df38c0f1861266e9010e7093816d130062a9d"},{"byte_count":16924,"path":"modes/_shared.md","sha256":"9c1619785765ad16145de43c7b342f4c839fd843a4cd3d83cfc01b2bc9e06fc4"},{"byte_count":8276,"path":"modes/_writing.md","sha256":"ec7549592feb604b9ef800169902a72232824eedfbde3020b5e6c72d399883f5"},{"byte_count":29042,"path":"modes/apply.md","sha256":"27383452c6a8d7db7c91bde319cd5a8edd99b8b26d7a06f0c5689498820d0e1f"},{"byte_count":2566,"path":"modes/heuristics/recruiter-side.md","sha256":"a22962edf419f9c63e39faf88367e3a95809f9319b23b69d6ce386de95125893"},{"byte_count":27504,"path":"modes/pdf.md","sha256":"5186cd795ef00b965a9a513a48df3f8353cd2ec2b7e99fdaea00c15cfbc9f22b"}],"product_baseline_revision":"bde5de661afbb72977a190e543ded24a72c9c86e","rc1_revision":"d2f2ad66133fa749e3b9b427b0de3dcad68d1295","registration_id":"RC2-CO-CLAUDE-CODE-2026-08-24-V4","repository":{"revision":"d2f2ad66133fa749e3b9b427b0de3dcad68d1295","url":"https://github.com/OpenCnid/recursus-careers","working_tree_state":"uncommitted_rc2_implementation_files_hashed"},"schema_version":"1.0","snapshot_id":"RC2-SOURCE-SNAPSHOT-04","synthetic":true}
